lien_emploie,date,nom_entreprise,secteur_activite,metier,poste_propose,localisation,delais,type_de_contrat,exigences
https://doopin.net/ZXLMe,03/08/2022,BiscuiterieBOBO,Commerce-Vente-Distribution,Commercial,STAGIAIRE COMMERCIAL(E) – Douala,"Akwa,Douala,Littoral,Cameroon",Postulerauplustôt,StageProfessionnel,"·       suivre les ventes hebdomadaires et la performance des différents points de vente|·      
Et bien sûr, avoir la Bobo Attitude et Think out of the box!|·       Être intéressé(e) par la boulangerie industrielle|·       Avoir une première
expérience réussie dans la vente|Nous recherchons un(e) stagiaire commercial(e) pour rejoindre une jeune entreprise à forte croissance avec de fortes perspectives internationales. Les principales missions sont :|·      
Être sympathique, passionné(e), ambitieux(se), et brillant(e)|Nos recettes de madeleines, sablés et cookies puisent dans le terroir camerounais pour proposer à nos Bobos des produits fabriqués localement sans conservateurs, ni colorants, ni additifs. Farine, Beurre, Pépites de chocolat,… chaque ingrédient est choisi avec soin pour garantir à nos Bobos un goût unique et authentique.|Créée en 2019, la Biscuiterie Bobo est une jeune entreprise spécialisée dans la production et la distribution de produits de snacking dans les restaurants, les petites et grandes surfaces au Cameroun.|·      
Avoir au moins le baccalauréat et être âgée de moins de 30 ans|·      
Être rigoureux(se) et consciencieux(se)|Présentation de l’Entreprise|·       développer le réseau de points de vente conformément au plan stratégique.|» Niveau d'expérience: Stagiaire 
                                                                                                                                » Niveau Académique Minimum: Baccalauréat|» 
                                                                    18 - 30                                                                     ans|A date, nos produits sont distribués dans plus de 40 points de vente à Douala et Yaoundé dont Carrefour Market.|·       gérer l'approvisionnement (stock) des points de vente|·      
Être autonome,
doué(e) d'une bonne
capacité d'organisation et doté(e) d'une incroyable aisance
relationnelle|Cliquer sur le bouton Postuler pour envoyer votre candidature en ligne
Ou envoyez-nous vos documents de candidature à l'adresse email madininafoods@gmail.com|» Curriculum Vitae|·       développer la présence quantitative et qualitative des produits Bobo dans les points de vente|» Lettre de motivation|Qualités requises|"
https://doopin.net/RgVVu,03/08/2022,GSERVICE,Commerce-Vente-Distribution,Employélibre-service,Ménagère Résidente – Yaoundé,"Yaoundé,Centre,Cameroon",07Aug.2022,Nonspécifié,"Jeune dame ayant de l'expérience comme babysitter et aimant s'occuper des enfants.|Merci de nous contacter au 654 35 37 17|Repas, hébergement et soins gratuitsUn jour de vacances par semaineSalaire attractif||Personnes pas sérieuses s'abstenir|Recherche Ménagère Residente pour le quartier Messamendongo|"
https://doopin.net/RcwBF,03/08/2022,BiscuiterieBOBO,Publicité-Marketing,Assistantmarketing,STAGE ANALYSTE MARKETING – Douala,"Douala,Littoral,Cameroon",31Aug.2022,StageProfessionnel,"|Exécuter et coordonner les animations commerciales promotionnelles dans les points de vente

Développer et exécuter le plan marketing digital|·      
Et bien sûr, avoir la Bobo Attitude et Think out of the box!|·      
Être sympathique, passionné(e), ambitieux(se), et brillant(e)|Nos recettes de madeleines, sablés et cookies puisent dans le terroir camerounais pour proposer à nos Bobos des produits fabriqués localement sans conservateurs, ni colorants, ni additifs. Farine, Beurre, Pépites de chocolat,… chaque ingrédient est choisi avec soin pour garantir à nos Bobos un goût unique et authentique.|Créée en 2019, la Biscuiterie Bobo est une jeune entreprise spécialisée dans la production et la distribution de produits de snacking dans les restaurants, les petites et grandes surfaces au Cameroun.|·      
Avoir au moins le baccalauréat et être âgée de moins de 30 ans|·       Être intéressé(e) par la boulangerie|Cliquer sur le bouton Postuler pour envoyer votre candidature en ligne
Ou envoyez-nous vos CV et LM à madininafoods@gmail.com|·      
Être rigoureux(se) et consciencieux(se)|Présentation de l’Entreprise|» Niveau d'expérience: Stagiaire 
                                                                                                                                » Niveau Académique Minimum: Baccalauréat|Autres informations  Job basé à Douala  Disponibilité immédiate souhaitée|» 
                                                                    18 - 30                                                                     ans|·      
Être autonome,
doué(e) d'une bonne
capacité d'organisation et doté(e) d'une incroyable aisance
relationnelle|» Lettre de Motivation|» Curriculum Vitae|A date, nos produits sont distribués dans plus de 40 points de vente à Douala et Yaoundé dont Carrefour Market.|Nous recherchons
un(e) stagiaire assitant(e) marketing & développement FMCG pour rejoindre
une jeune entreprise à forte croissance avec de fortes perspectives
internationales. Les principales missions sont :|·       Avoir une première
expérience réussie dans le
marketing digital|"
https://doopin.net/boCzI,03/08/2022,Wendyfy237,Mode-Textile,Styliste,STYLISTES – Yaoundé,"Yaoundé,Centre,Cameroon",Postulerauplustôt,Nonspécifié,RECRUTEMENT DES STYLISTES|Si toi aussi tu es intéressé clique via le lien suivant 👉https://chat.whatsapp.com/GHxCs1rPya7CfJqvOTjhuA|Si tu es dans la ville de Yaoundé et que tu es un homme où une femme et tu as des compétences techniques en stylisme modélisme et tu cherches une structure avec laquelle tu voudrais commencer à travailler|
https://doopin.net/vCCAE,03/08/2022,UnEmployeur,Hôtellerie-Restauration,Cuisinier,CUISINIER – Douala,"Douala,Littoral,Cameroon",Postulerauplustôt,Nonspécifié,- Dynamique & Disponible ;|Envoyez-nous votre CV à l'adresse e-mail lapietrafricana@yahoo.comAncien Immeuble CAMAIR LIQUIDATION / BONANJO|- Coordination des équipes ;|- Préparation des plats et commandes ;|- Respect De La Hiérarchie|- Courtois;|- Espr
https://doopin.net/ukVTg,03/08/2022,MAISONMODJO,Mode-Textile,Couturier,COMMIS D'ATELIER – Douala,"Douala,Littoral,Cameroon",Postulerauplustôt,Nonspécifié,"|Nous offrons un espace pour travailler avec nous de jour et en semaine|CONTACTEZ NOUS AU maisonmodjo@gmail.comDouala -Ndogbong CameroonTel: 696399801|Si tu es passionné de mode , tu voudrais acquérir ou développer tes compétences, relever de nouveaux défis si tu es dévoué, débrouillard et a le sens des responsabilités nous te formerons pour apprendre le métier et une possibilité d'avancement /d'intégration est à ta portée ! on est prêt à te rencontrer.||NOUS RECHERCHONS UN(E) COMMIS D'ATELIER|NOTRE ENTREPRISE EST EN PLEINE EXPANSION ET NOUS RECHERCHONS UN PROFIL POUR REJOINDRE NOTRE ÉQUIPE|» Curriculum Vitae|"
https://doopin.net/kqinm,03/08/2022,MENBUILDERSARL,Commerce-Vente-Distribution,Commercial,COMMERCIAUX ÉLECTROMÉNAGERS – Douala,"Douala,Littoral,Cameroon",09Aug.2022,Nonspécifié,"|Ø Minimum BAC+2/3 en Marketing-Commerce-Vente ou tout diplôme équivalent ;|Ø Très bonnes aptitudes commerciales;|Faites parvenir votre CV et les justificatifs de votre expérience à l'adressecvmenbuilder@gmail.com et préciser le poste en objet ou alors les déposer dans nos bureaux sis à Bonanjo, Immeuble CRÉDIT FONCIER, 4è Étage Porte 401.    Date limite de réception des candidatures Mardi, le 09 Août 2022.|Ø Être dynamique, motivé et flexible ;|Ø Minimum 02 (deux) années consécutives et avérées à un poste similaire ;|Ø Être disponible immédiatement.|Le cabinet MEN BUILDER spécialisé dans le placement du personnel recherche pour un de ses clients du domaine de la Grande Distribution des COMMERCIAUX ÉLECTROMÉNAGERS.|» Niveau d'expérience: Expérimenté|» Curriculum Vitae|» Années d'expérience: Entre 2 an et 3 ans 
                                                                                                » Niveau Académique Minimum: Bac+2 (BTS / HND,...)|Poste basé à DOUALA|"
https://doopin.net/ZGRNC,03/08/2022,OptimumB&BSARL,Comptabilité-Gestion,Comptable,COMPTABLE – Douala,"Douala,Littoral,Cameroon",Postulerauplustôt,StageProfessionnel,"» Lettre de Motivation|BTS minimum en comptabilité et gestion des entreprises Aptitudes : Maitrise des écritures comptableConnaissance de l'outil informatique Analyse des comptes Qualité : Rigoureuse, méthodique et méticuleuse|» Niveau Académique Minimum: Bac+2 (BTS / HND,...)|» Niveau d'expérience: Stagiaire||OPTIMUM RECRUTE UNE STAGIAIRE COMPTABLE PRÉ EMPLOI|» Curriculum Vitae|Veuillez cliquer sur le bouton Postuler ci-dessous pour soumettre votre candidature|"
https://doopin.net/RBMku,03/08/2022,HSDMELT–CAMEROUN,Commerce-Vente-Distribution,Commercial,Commercial (e) – Douala,"Douala,Littoral,Cameroon",05Aug.2022,Nonspécifié,"|conseiller les clients et leur proposer une offre personnalisée et adaptée, pour se démarquer des concurrents. Démarcher les potentiels clients, négocier les prix. Elaborer des stratégies pour dynamiser les ventes, Gérer son portefeuille client, ou encore assurer un suivi commercial auprès de la clientèle afin de la fidéliser.|Formation : Diplôme de commerce ou Bac + 3 Minimum 3 ans d’expérience en tant que commercial B2BAvoir déjà un bon carnet d’adresses d’entreprises au Cameroun, surtout avec les DG, DAF ou Départements Achats des Entreprises||Rencontrer ses clients et prospects afin de leur vendre les produits et services en adéquation avec leurs besoins.|» Niveau d'expérience: Expérimenté|Veuillez cliquer sur le bouton Postuler ci-dessous pour soumettre votre candidature|» Années d'expérience: Entre 3 ans et 5 ans 
                                                                                                » Niveau Académique Minimum: Licence|» Curriculum Vitae|Notre Client, entreprise exerçant dans l’industrie d’habillement, basée à Douala recherche un (e) commercial (e) pour accompagner le développement de ses activités au Cameroun.|"
https://doopin.net/VzaqT,03/08/2022,FédérationinternationaledesSociétésdelaCroix-RougeetduCroissant-Rouge(IFRC),Humanitaire,Autres,"Officer, Planning, Monitoring, Evaluation and Reporting – Yaoundé","Yaoundé,Centre,Cameroon",16Aug.2022,Nonspécifié,"Support National Societies during micro-planning and review of micro-plans.|Lead or manage program evaluationEnsure evaluations are done as prescribed and in accordance to IFRC evaluation FrameworkLead and support lesson learn and reviews meetings for the programDocument the lessons and agreed action points from above meeting and follow up to ensure they inform program improvement.Use qualitative data when applicable and advise on qualitative data collection methods and good practices (including interview skills, focus group facilitation, and survey design and response categories).Advice on sampling techniques (such as random, stratified, and purposive) and their applications and relevance for a selected evaluation or methodology.Provide quality control during the review and comment phase throughout the evaluation process.Support drafting of Management response to ensure learning from evaluations are actioned.Identify opportunities for participatory evaluation and integration with Community Engagement and Accountability to ensure evaluations consider community input|Provide training on monitoring and evaluation for IFRC and National Society staff as requested.Identify and secure opportunities for National Societies to build capacity.Support in identify risk in SLL implementation and escaling to the relevant IFRC staff for actionSupport in tracking implementation and monitoring budgets|The position holder will:|» Niveau d'expérience: Expérimenté|1/Planning|Advise on the utility of various types of data collection and analysis tools using available analysis toolsLead data analysis and visualization of data collected to support program monitoring and donor reporting. This will include developing dashboards as needed||Preferred|» Curriculum Vitae|Minimum of 2 years work experience in an international setting.Experience working in the developing countriesExperience working in the Africa RegionPeople Management experience|4/Lead Data analysis|University degree, or equivalent, in relevant disciplines (Monitoring and Evaluation, Mathematics, Statistics, Economics, or relevant quantitative fields )Relevant professional training or relevant experience in monitoring, performance-based management, planning or evaluation.|6 / Support Grant and risk amangement|This position will lead the implementation of appropriate monitoring and evaluation processes and systems to support project management, impact assessment and learning. Providing technical support to program management unit (PMU), the Officer PMER will ensure, planning, data collection, analysis and dissemination of monitoring and evaluation results and donor-related reporting. The position will lead learning and evaluation and ensure lessons learnt are incorporated into the program.|3/Support evaluations through technical leadership and management, including:|5/ Support effective communication of monitoring and evaluation information|Ensure the collation of inclusion of appropriate program and project monitoring and evaluation information into external and internal reportsEnsures best practices are captured and disseminated among NSSupport the sharing of findings and lessons learned to improve programmatic and organizational learning.Provide constant communication and support to ensure NS are aware of their monitoring and evaluation obligations.Collate, write or manage, donor reporting and evaluation reports as necessaryConduct quality and technical review of donor reports, operation reports, and other reports to ensure all reports are of high quality.|Ensure that monitoring plans are in place for all National Societies.Develop and maintain monitoring and reporting schedules for the programProvide technical leadership to ensure monitoring and reporting systems contribute to reliable data collection and timely analysis of program and project results.Provide technical leadership to facilitate the use of monitoring data for analysis and decision making.Support lead National Society to aggregate monitoring results and feedback from other implementing National Societies.Establish systems to remind and prompt National Societies to submit monitoring reports against schedules set for all projects and programmesProvide input to the development of quality standards and tools in the areas of monitoring and evaluation.|» Années d'expérience: Entre 2 an et 3 ans|2/Lead the establishment and maintenance of monitoring systems, including:|Veuillez cliquer sur le bouton Postuler ci-dessous pour soumettre votre candidature|"
https://doopin.net/tpenW,03/08/2022,CANISSARL&LESASTÉROÏDES,Comptabilité-Gestion,Assistantcomptable,Assistant comptable – Douala,"Douala,Littoral,Cameroon",05Aug.2022,Nonspécifié,"» 
                                                                    21 - 28                                                                     ans|» Justificatifs|CV à jour précisant la date de naissance et les références du candidat,  - Lettre de motivation, - Document attestant votre niveau d'études ; - Tout Document nécessaire, permettant d'apprécier la candidature.NB: Seules les candidats retenus pour les prochaines étapes seront contactés.|vous êtes diplômé d'un Bac+5 ou d'un licence en comptabilité et gestion des entreprises, comptabilité et finance ,en fiscalité et pouvez valoriser une expérience professionnelle à un poste d'assistant comptable d'au minimum 3 ans d'expérience.|PROFIL RECHERCHÉ|Capacité de structurer la comptabilité et les processus liés,Connaissance parfaite des logiciels Sage SAARI et pack office ( Word, Excel, PowerPoint)Maîtriser la comptabilisation des opérations courantes des entitésMaîtrise de la liquidation des impôts et taxesGestion des activités de ressources humaines,Maîtrise de l'analyse financière des entités.|» CV|» Lettre de motivation|» Années d'expérience: Entre 2 an et 3 ans 
                                                                                                » Niveau Académique Minimum: Licence||» Diplômes|Âgés entre 21 et 28 ansAyant minimum Bac+3Année d'expérience : 3 ans, minimum 2 ans 6 moisAvoir comme objectif de bâtir une carrière en cabinetAvoir un esprit d'analyse et être à l'aise avec les chiffresParler et écrire au moins une des deux langues officielles.|COMPÉTENCES PROFESSIONNELLES.|Dans le cadre de renforcement de son équipe CANIS SARL  LES ASTÉROÏDES recherche Un (e) assistant (e) comptable pour un stage pré-emploi. poste basé à Douala Cameroun (Déido à côté de l'université des eaux)|"
https://doopin.net/TInzz,03/08/2022,SPARCAMEROUN,Publicité-Marketing,Assistantmarketing,Assistant Marketing – Douala,"Douala,Littoral,Cameroon",07Aug.2022,Nonspécifié,"Qualification|» Curriculum Vitae|» Lettre de motivation|Digital Marketing Branding Event Planing Bilingual MS Office Graphic Design(Basics)|We are growing fast so, join our team ! As the Marketing Assistant you will be an integral part of our team. Where you will be tasked with creating, implementing and improving best practices ensuring continual enhancement of our marketing efforts.||Veuillez cliquer sur le bouton Postuler ci-dessous pour soumettre votre candidature|"
https://doopin.net/OrWjC,03/08/2022,HSDMELT–CAMEROUN,Secrétaire-Assistant(e),Assistant(e)dedirection,Attaché (e) de Direction – Douala,"Douala,Littoral,Cameroon",11Aug.2022,Nonspécifié,"» Curriculum Vitae|ACTIVITES|» Années d'expérience: Entre 5 ans et 8 ans 
                                                                                                » Niveau Académique Minimum: Bac+2 (BTS / HND,...)|Veuillez cliquer sur le bouton Postuler ci-dessous pour soumettre votre candidature|Formation : Diplôme de gestion administrative/commerce  Bac + 2 minimum Minimum 5 ans d’expérience à un poste similaireBon relationnel|Soulager le Directeur Général de toutes les préoccupations administratives et, d'une manière générale, l'assister dans tous les aspects de son travail afin de lui faire gagner du temps et de l'efficacité.||» Niveau d'expérience: Expérimenté|Notre Client, entreprise exerçant dans l’industrie des engins automobiles, basée à Douala recherche un (e) attaché (e) de Direction pour accompagner le développement de ses activités au Cameroun.|Aider le Directeur Général à organiser, planifier et mettre en œuvre la stratégie et les procédures Aider le Directeur Général à mettre en place et à améliorer la réglementation et le système de gestion de l'entreprise Rassembler et analyser le rapport financier et faire des suggestions au DG Recueillir et analyser le rapport des différents services et faire des suggestions au Directeur Général Organiser et coordonner les informations et les actions internes externes, parfois confidentielles, liées au fonctionnement de la structure. Superviser les employés en s'assurant qu'ils respectent le règlement de l'entreprise et les normes de service à la clientèle. Veiller au respect du règlement intérieur et des procédures de l'entreprise. Assurer la liaison entre les employés de première ligne et le DG. Les motiver à travailler de manière productiveOrganiser les rendez-vous et les réunions du DGTraiter toute question en temps opportunÊtre attentif aux plaintes des clients, leur faire des suggestions et s'assurer que la réaction sera faite en temps utileSuivre d'autres tâches assignées par le GM Participer les opérations liées aux achats à l'international|"
https://doopin.net/sqZgW,03/08/2022,HEKA,Art-Design,Designergraphique,GRAPHIC DESIGNER – Yaoundé,"Yaoundé,Centre,Cameroon",Postulerauplustôt,Nonspécifié,"|Nous cherchons particulièrement une personne :|» Curriculum Vitae|MODALITES DE TRAVAIL  8h – 17h de lundi à vendredi8h – 14h le samediCamp Sonel Essos, Yaoundé|Contact : 679892934 ou via le lien WhatsApp https://wa.me/237679892934|» Portfolio|CréativeAvec une maîtrise complète des logiciels Adobe photoshop, Illustrator, IndesignCapable de travailler sous pressionEtre disponible à temps plein||HEKA, une entreprise de Design Graphique et de Marketing Digital, recrute dans le cadre de l’expansion de ses activités|Pour postuler, veuillez nous laisser votre CV et votre portfolio 
(fichier de moins de 2Mo) sur notre formulaire de recrutement via le 
lien www.hekadesign.com/recrutement|"
https://doopin.net/emNrx,03/08/2022,LACENTRALEINFORMATIQUE,Administration,Secrétaire,"Recrutement: Secrétaire, Maintenancier des réseaux informatiques, Apporteurs d'affaires – Yaoundé","Yaoundé,Centre,Cameroon",15Aug.2022,Nonspécifié,"Localisation: Yaoundé, Marché central|Dans le cadre de son développement et de son expansion, La Centrale Informatique recrute les postes suivants :|Le dossier doit contenir :|NOUS RECRUTONS|Le CV La photocopie de votre CNIUn plan de localisation|Et ce au plus part le 15 Août 2022 à 17h00||Une secrétaireUn maintenancier des réseaux informatiquesDes apporteurs d'affaires|Vous pensez être à la hauteur, envoyez nous dès à présent votre dossier via WhatsApp : https://wa.link/bgdoen|"
https://doopin.net/LTVRh,03/08/2022,ZININDUSTRIESSARL,Comptabilité-Gestion,Comptable,Comptable – Yaoundé,"Yaoundé,Centre,Cameroon",14Aug.2022,Nonspécifié,"Avis de recrutement : Comptable|» Années d'expérience: Entre 3 ans et 5 ans 
                                                                                                » Niveau Académique Minimum: Master|Mise en place du service comptable et de la payeSupervise les processus comptables, produit les documents de synthèse budgétaire et traite la paye.Assure la conformité de l'entreprise aux normes et contraintes réglementaires en vigueur, et veille à ce que les déclarations sociales et fiscales soient à jour et exactes.Réalise les diagnostics financiers, assure les contrôles périodiques et inopinés et prépare les audits de l’entreprise.Répons aux sollicitations des administrations sur toutes les questions fiscales et sociales.Suit les mesures de performances économiques de l'entreprise.|Pour soumettre votre candidature, veuillez envoyer votre dossier comprenant un CV et une lettre de motivation au plus tard  14 Août 2022Localisation : Yaoundé Cameroun|» Lettre de motivation||» Niveau d'expérience: Expérimenté|» Curriculum Vitae|Bac+4 en Comptabilité, Fiscalité ou FinanceExpérience significative de 3 à 5ansBonne connaissance des comptabilités des entreprises industriellesBonne maîtrise des schémas comptables et de la comptabilité analytiqueParfaite maîtrise du SYSCOHADABonne connaissance de la fiscalité CamerounaiseParfaite maîtrise de l'informatique et des outils bureautiques (Excel, Word et PowerPoint)Parfaite compréhension des outils intégrés de gestion (ERP)Confortable avec les chiffres et grande attention aux détailsBon animateur d’équipe à l’aise avec les prises de responsabilité|Une expérience en cabinet d'audit constituerait un atout|"
https://doopin.net/LDMWv,03/08/2022,UnEmployeur,Esthétique-Beauté-Coiffure,Esthéticienne,02 ESTHÉTICIENNES MASSEUSES PROFESSIONNELLES – Douala,"Douala,Littoral,Cameroon",Postulerauplustôt,Nonspécifié,"Active dans les réseaux sociaux possédant déjà un porte feuille client Avoir une expérience de minimum 2 ans NB: être souriante, accueillante et avoir le sens d'équipe|Tel 681638951|Nous recherchons 2 esthéticienne masseuses Professionnelles|» Années d'expérience: Entre 2 an et 3 ans|?OFFRE D’EMPLOI?||» Niveau d'expérience: Expérimenté|Si tu pense remplir c’est critères :Déposez votre CV à bonapriso hôtel le sportif Douala Cameroun|» Curriculum Vitae|"
